{
  "schema_version": "sidecar_evaluate_request_v1",
  "proposal_id": "3b3c2e8c-6e24-4f39-9a5f-2f3bf2e4a9e1",
  "actor_type": "agent",
  "action_type": "payment",
  "payload": {
    "currency": "USD",
    "amount": 12000,
    "destination": "acct_123"
  },
  "context": {
    "request_id": "req_abc",
    "model": "gpt-4.1"
  }
}
